{"createdAt":"2026-02-02T00:00:00.000Z","currency":"USD","invoiceId":"invoice_fixture_unsigned_matrix","jobProof":{"embeddedPath":"payload/job_proof_bundle","headAttestationHash":"c70b62f9e28ac91fa07073c802495d1801921c0d01924a2538f981a7e18f8d5b","manifestHash":"6775ce8a23cb436fdd6e2809bf79d2b1ac05f76a820094342b0cc68f425ef9d8"},"lineItems":[{"amountCents":"1500","code":"WORK_MINUTES","quantity":"10","unitPriceCents":"150"}],"schemaVersion":"InvoiceClaim.v1","subtotalCents":"1500","tenantId":"tenant_fixture","totalCents":"1500"}
